Unnamed: 0,date,score,reviews,sentiment
5932,2022-06-17 11:02:23,1,연락처가 바뀌게 되서 개인정보 수정 하려고 하는데 수정도 않되고 코드번호도 바뀌기 전에 사용하던 연락처로 전송이되는지 코드번호가 오지도 않고 이메일로도 코드번호가 오지도 않고 여행 다닐때 사용 잘했는데 개인정보 수정이 않되서 최악이 되버렸네요,9
5933,2022-06-17 18:21:26,5,쉽고 편하네요,1
5934,2022-06-17 23:08:34,1,영수증 확인 불가 pdf 파일 오십번 다운 받음,9
5935,2022-06-19 11:48:15,5,간편함 자세함,5
5936,2022-06-20 16:08:54,3,에어비엔비 카드 도용 범죄가 자주 일어나는데 왜 결제 수단을 카드 결제에만 취중 하는지 모르겟네요 한국에 카카오 페이나 무통장 입금 가상계좌 이런것로 결제 되게 해야 되는거 아닌가요 내가 지불할수 있는 비교적 안전한 결제 시스템을 왜 고려안하고 카드결제만 고집하는지 애플페이는 왜 결제수단에 넣었는지 애플페이 쓰는사람이 많을까요 한국에 카카오 페이 쓰는사람이 많을까요 안전하게 결제 될만한 결제 수단 이 있으면 더 이용할거 같은데요 불안해서 비싸도 다른 숙박 사이트로 돌아서게 되네요,7
5937,2022-06-22 22:13:39,1,주택가 한복판 꼭대기층 옥상에다가 에어비앤비 해놓으면 어떡합니까 매일 밤마다 옥상에서 파티하면서 술 먹고 소리 지르고 노래 부르고 게임하는 소리 때문에 시끄러워서 잠을 못 자겠습니다 남한테 피해 주는 사회악 쓰레기 기업,9
5938,2022-06-23 01:30:57,5,이쁜 숙소가 많아요,5
5939,2022-06-23 09:18:35,5,만족스러워요,0
5940,2022-06-23 20:07:48,2,국내 펜션예약했는데 달러변환인가 그거 안하면 수수료 들고 알려주지도 않고 프로필설정 펜션주인에게 메세지쓰기 등 안하면 예약도안되고 이번만쓰고 안쓸거임,9
5941,2022-06-23 20:16:28,4,안전하게 예약 할수 있고번역기 능력이 뛰어나 의사 소통에 어려움이 없음,5
5942,2022-06-24 05:42:49,1,결제시스템이 아주 개판이네요 그냥 다른앱쓸게요,9
5943,2022-06-24 12:38:59,1,호스트입니다계정이 지속적으로 허위숙소 신고라는 이유로허위숙소아님 합법숙소 차단되고 모든 자료를 제출해도 복구속도도 느리고 한달넘게 지난뒤 복구됐다가 하루만에 또 차단됨 시스템 오류라고 또 하루뒤에 복구 해줬다가 그날 또 계정차단되고 며칠째 개선안되고 있음 담당자 연결도안되고 영업불가 차후에도 재발될 우려 많이 있음 답변에 해결방법 적어주셨는데 계정이 차단되면 로그인이 불가해서 도움말에서 요청 자체가 안됩니다,9
5944,2022-06-25 11:02:58,5,다양한 숙소 정보를 안내 해주셔서 편리합니다,1
5945,2022-06-26 07:46:10,2,본인인증 셀카까지 찍으니 민망하네요,9
5946,2022-06-26 09:53:36,5,여행 숙박의 패러다임을 바꾼 회사,6
5947,2022-06-26 16:29:32,5,좋아용,0
5948,2022-06-26 23:28:53,5,아주 깨끗해요,0
5949,2022-06-27 14:02:31,5,덕분에 좋은 숙소선정하여 좋은 가족여행이 되었습니다,1
5950,2022-06-27 22:27:11,5,짱조아요,0
5951,2022-06-29 09:43:55,1,거지같아요 회원 가입하자마자 예약도 하기전에 2달러 띳겼네요 절대하지마세요,9
5952,2022-06-30 09:10:09,1,호스트와 연락이 안되는 예약건이 2번 연속 있었고 첫번째 예약이 안되서 보상 쿠폰을 받았으나 2번째 또 불미스러운 일이 발생하고 호스트와 통화후 아무것도 모른다고 에어비앤비랑 얘기하라고 합니다 에어비앤비는 무작정 여행날 나갈올 때까지 기달리라고 하고 직접 취소하면 보상 쿠폰은 다시 사용을 못한다고 합니다 여행 다갈올 때까지 기달렸다가 예약할 곳 사라진 후에 집을 찾으라는 건지 보상 쿠폰을 주지만 사용 은 못하게 하고 호스트가 회사를 그만 뒀다고 모른다고 하고 개인거래 하자고 호스트가 유인하고 그냥 이런 단점이 있어요,9
5953,2022-06-30 11:59:24,5,다른 숙소예약어플에 비해 가격도 저렴하고 숙소이용도 깔끔하고 좋습니다,1
5954,2022-06-30 22:05:05,5,유용함,0
5955,2022-06-30 22:49:10,1,사기꾼들이 많은데 에어비앤비는 책임지지 않는다,9
5956,2022-07-01 01:53:09,5,해외여행시 매번 좋은숙소를 저렴하게 잘구하고 있습니다 추천합니다,0
5957,2022-07-02 14:07:07,5,맘에 꼭 드는 숙소를 찾았어요,0
5958,2022-07-03 12:54:28,5,항상좋은조건으로보고있습니다,5
5959,2022-07-03 14:00:49,5,믿고 사용할수 있어요,1
5960,2022-07-03 17:29:17,5,좋았어요,0
5961,2022-07-04 05:40:21,1,내계정인데 인증을 해도 로그인이 안됨 어쩌라는거임,9
5962,2022-07-04 06:10:19,5,다양하고 깨끗한 숙소가 미음에 들며 솔직한 리뷰의 도움을 많이 받습니다,1
5963,2022-07-04 11:02:42,5,아주 좋음,0
5964,2022-07-04 13:26:06,3,프랑스,5
5965,2022-07-06 12:18:34,5,전에 지인들과 에어비엔비를통해서 여행을한것이 기억나서 들어왔습니다,4
5966,2022-07-07 00:11:12,4,유저 프렌들리해요,0
5967,2022-07-07 05:03:29,5,정말 간편하고 좋아요,0
5968,2022-07-08 00:11:54,5,저렴하고 조건에 맞는 숙소를 찾을수 있어서 참 좋아요,0
5969,2022-07-08 13:20:18,5,좋은 숙소가 많아요,5
5970,2022-07-09 06:25:06,1,역시 한국은 이런것도 비싸네,9
5971,2022-07-09 13:32:47,5,네이버 펜션예약보단 훨 낫습니다 싸고 좋은데 많음,5
5972,2022-07-09 14:38:18,1,결제오류가 자기탓 아니라는 에어비앤비 덕분에 75만원 허공에 잘 뿌렸습니다 어떠한 증거를 내 밀어도 조사도 안하는 곳,9
5973,2022-07-09 15:58:50,5,편리하고 직관적입니다,1
5974,2022-07-10 10:49:13,1,카드 등록은 되는데 삭제하려하니 카드만 등록하라는 창만 뜨네요 요즘 에어비엔비 카드 도용사건도 많아서 삭제하려했더니만 도용을 막지 못할 뿐더러 삭제도 안된다니 최악입니다 여행을 위해서 이용하긴 하겠지만 다음엔 최대한 이용 안하지 싶어요,9
5975,2022-07-10 12:45:14,5,아직모르겠으나 사용은 만족,7
5976,2022-07-10 21:21:27,5,설명도 자세하고 좋은 여행의 시작이 될것같아요,0
5977,2022-07-11 09:04:58,5,해외뿐아니라 국내여행시 현지에가서 숙소를 찾아야하는 번거러움을 덜 수 있고 별장같은 기분을 느낄 수 있어서 참 좋습니다,0
5978,2022-07-11 17:54:12,5,좋아요 편했어요,0
5979,2022-07-12 07:31:35,4,쓸만함,5
5980,2022-07-12 11:19:55,5,늘 잘 사용하고 있습니다 좋아요,1
5981,2022-07-14 14:28:02,5,외국이나 국내 이용이 너무도 편리하게 이용하고 있읍니다,1
5982,2022-07-14 16:36:30,5,좋은경험이되었네요,1
5983,2022-07-15 06:10:10,5,가성비 갑 강추,0
5984,2022-07-16 09:15:01,5,잘 사용하고있습니다,1
5985,2022-07-16 10:39:41,1,호스트모드에서 세무 비용처리를 위한 인보이스 발행이 일부밖에 안됨 해결을 위해 여러번 에어비앤비 서포트팀에 문의를 해도 엉뚱한 소리만하고 3달째 해결이 안됨 기술적으로 오류가 있는 걸 인정하고 수정하려고 하지 않음 플랫폼 수수료도 엄청 받으면서 글로벌 거대플랫폼이라 일개 사용자의 불편은 해결을 안해줌,9
5986,2022-07-16 17:29:46,1,필요한것좀 한 번에 인증하라고해요 몇 번이나 왔다갔다 하,9
5987,2022-07-17 21:16:11,5,애용하고 잇어용,1
5988,2022-07-17 22:58:52,1,가입하려는데 안넘어가네요 진짜 짜증나는 앱이고 개발을 뭐 이딴식으로 하나요,9
5989,2022-07-17 23:23:07,5,국내국외 저렴한가격에 상태 굿,0
5990,2022-07-18 01:12:30,1,회원가입 조차 하지 않았는데 단기간에 계정을 많이 만들었다니 이정도로 개판인 앱은 오랜만이네요 새로웠습니다,9
5991,2022-07-18 17:34:43,1,ui최악 숙소예약때문에 어쩔수없이 사용하지만 신용카드 결제부분에 관해서는 나아지는게 없는것같아요,7
5992,2022-07-18 17:40:07,1,카드 등록하는데 가이드도 없고 뭐가 안되는건지 표시도 없고 그저 검색해서 하나씩 해봐야함 그러면서 수수료는 받아감,9
5993,2022-07-19 19:19:04,5,정확하고 신뢰할수있는 앱,5
5994,2022-07-20 01:06:12,2,앱에서 회원가입이 안돼서 웹브라우저의 소중함을 깨닫게 해줌 보안에는 신경을 써서 마구 인증요청을 하다보면 한시간동안 인증이 불가하지만 웹을 통해서 요리조리 들어가면 회원가입의 문을 통과할 수 있음 왜인지 모르겠는데 결제수단 등록하면 1usd를 결제함 별이 2개인 이유는 아이콘 디자인은 예쁜데 별 15개를 줄 수 없어서임,6
5995,2022-07-20 08:24:36,1,회원가입이 계속안된다 핸드폰을 껐다 켜도 안된다 어쩌라는 거지,9
5996,2022-07-20 10:49:32,1,가입할 때 정보 다 입력하고 동의 및 계속 100번 누르는데 안됨 앱끄고 다시 해봐도 안됨 앱을 뭐 이따구로 만든거야 가입이 안되면 어떻게 보는데,9
5997,2022-07-20 12:14:33,1,회원가입 동의 및 계속하기에서 넘어가지가 않음 3번째 시도중,9
5998,2022-07-20 18:10:04,1,hhttp 420 오류로 일주일 어플 넘게 사용 못하는중,9
5999,2022-07-20 18:24:45,2,가입할 때 오류가 심합니다 동의 및 계속하기 창이 안 눌러져요,9
6000,2022-07-20 19:57:07,5,사용하기 편합니다해외여행은 아직,5
6001,2022-07-20 22:49:14,1,회원가입 로그인이 안되네요 어떻게 해야하나요 노트20울트라입니다,7
6002,2022-07-20 22:59:36,5,가격대비 좋은곳 많아서 좋네요,1
6003,2022-07-21 06:23:32,3,회원가입시 원활하지않은 부분이있음 계정가입시 첫페이지 이후 진행이 안되거나 프로필 사진 등록시 카메라 구동도 안됨 등등 너무어려움,9
6004,2022-07-21 10:21:13,1,회원가입하려는데 동의및 계속하기에서 안넘어가네요,9
6005,2022-07-22 09:12:30,1,아니 왜 가입하는데 동의 및 계속하기에서 안넘어가는건지여러번햐도 마찬가지에요 그냥 삭제하려구여,9
6006,2022-07-22 15:20:24,1,다른건 다모르겠고 로그인 및 회원가입이 안되면 어쩌자는거임 동의 및 계속하기 계속 갈겨도 안되는건 쓰지말라는건가,9
6007,2022-07-22 18:01:43,1,회원가입이 안돼요 동의 및 계속하기 버튼이 안 눌립니다,9
6008,2022-07-23 15:34:27,4,저는 갑작스럽게 여행갈때도 이 어플덕에 숙소 걱정은 안해요,1
6009,2022-07-23 16:39:37,5,좋았음,0
6010,2022-07-23 17:57:50,1,엄청 불편하게 해서 질림,9
6011,2022-07-24 12:54:59,1,가입하려하니 왜 동의버튼눌러도 넘어가질않죠 가입이안되요 예약하려하는데,9
6012,2022-07-24 15:26:48,4,늘 사용해서 편함,0
6013,2022-07-24 18:49:37,5,빠르고 간편한 결재 좋아요,1
6014,2022-07-24 19:50:56,1,회원가입이 안돼요 동의 및 계속하기 버튼이 안 눌러짐,9
6015,2022-07-24 20:59:40,5,정말 판타스틱하게 좋다,0
6016,2022-07-25 00:52:09,1,회원가입 않 되요,9
6017,2022-07-25 07:04:06,5,잘 쓰고 있습니다 호텔보다 좋은 경험을 선사합니다,1
6018,2022-07-25 13:22:36,4,좋은 숙소 예약했어요,0
6019,2022-07-25 15:57:41,4,만족스럽습니다,0
6020,2022-07-25 17:32:46,5,항상잘이용해요,1
6021,2022-07-25 23:04:29,1,국내 숙박업소를 해와결제로 이용해야하는 아이러니 별로예요,9
6022,2022-07-26 03:35:34,4,앱 인터페이스도 이쁘고 품질 관리도 어느 정도 되는 것 같기야 한데 숙소 필터 설정 후 가격 순 정렬이나 평점 순 정렬같은 기능을 쓸 수 없어서 찾기가 매우 힘듭니다 리뷰의 절대적 개수가 적은 것 무엇보다도 부정적 평점부터 보는 기능이 없는 것도 결격 사항 체크에 매우 불리하고요 그래도 에어비엔비로 예약한 숙소들은 대부분 괜찮았어서 4점 드립니다 앱 기능만 좀 편하게 좀,7
6023,2022-07-26 10:59:05,5,좋아욘,0
6024,2022-07-26 12:26:43,1,로그인이 왜자꾸 안되죠,9
6025,2022-07-26 12:32:04,5,많은 숙소 검색이 좋네요,0
6026,2022-07-26 13:23:48,5,바로바로 업뎃도 잘되고 늘 잘 이용하고있어요,1
6027,2022-07-26 14:14:40,1,아니 왜 회원가입이 안되죠 정보입력하고 동의및계속하기 버튼 누르는데 안넘어가요 몇번이나 지웠다깔고해도 그대로네요,9
6028,2022-07-26 15:58:10,5,기대이상의 숙소들대가족여행숙소에 최적,0
6029,2022-07-27 07:58:55,5,늘 만족스런 숙소를 찾을 수 있어 편하게 쓰고 있습니다,1
6030,2022-07-27 21:43:58,5,굿굿,0
6031,2022-07-28 09:24:32,4,처음이라 더 경험해 보고 평가 할께요,5
6032,2022-07-28 10:48:35,5,메시지 삭제 기능이 왜 없나요 예약취소된 고객과 오래전에 왔던 고객 메시지는 삭제하고 싶은데 보기 불편합니다 예약 확정된 고객들 사이사이에 취소된 고객을 지울 수 있게 해주세요,9
6033,2022-07-28 15:40:44,5,고객센터 대박 친절,0
6034,2022-07-29 11:29:06,5,만족,0
6035,2022-07-29 15:43:41,5,가입절차는 까다로우나 확실하네요,6
6036,2022-07-30 16:53:11,1,정말 최악의 앱과 최악의 고객서비스 내가 나인데 내 신분증 사진과 내얼굴을 ai가 알아보지 못해 계속 개인인증이 안되어 예약조차 못하고 있음 고객서비스도 로보트처럼 응대하고 미국도 아닌데 미국감성으로 서비스를 제공함 결론 시간낭비니 앱깔지 마세요,9
6037,2022-07-31 11:12:45,1,결제내역 확인하려고 하는데 로딩창만 나오고 내역은 안나와요 친구들이랑 정산해야되는데 너무너무 불편해요,9
6038,2022-07-31 22:10:10,4,앱 자체가 해외라서 다른 나라 숙소 보기 정말 편하고 좋아요 단지 수수료가 비쌀뿐,6
6039,2022-07-31 23:51:19,5,조금만 작동해보면 쉽고 편리합니다,1
6040,2022-08-01 04:00:43,1,아니 카드 등록 했는데 왜 돈이 빠져 나가나요,9
6041,2022-08-01 14:26:12,5,좋아요 진심,0
6042,2022-08-02 18:07:13,5,항상 제일 많이 이용하는 곳입니다 좋아요,1
6043,2022-08-02 21:34:04,1,뭐 하나도 못 하겠다 지도에서 찾는 것도 안되고 이거 왜 이딴식으로 바꼈냐 지워야겠다,9
6044,2022-08-03 17:54:34,1,어플 사용이 굉장히 어려움 그리고 고객센터가도 답변안알려주던데 그냥 여기다 답변해주세요 결제수단 등록하래서 체크카드도 됀다길래 등록하는데 1984원이라는 돈만 출금돼고 이용불가라고 뜨던데 뭐하자는건가요 뭐 설명도 제대로 된게 없고 계속 이러는데 제대로됀 답변 부탁드릴게요,9
6045,2022-08-03 22:18:01,5,편리하게 원하는지역 숙소를 저렴하게 이용할수 있습니다,5
6046,2022-08-04 09:39:38,2,환불 취소정책에 대한 자세한 설명이 없음 불편,9
6047,2022-08-04 16:54:15,5,편하고 친절함,0
6048,2022-08-04 18:28:46,5,실시간 좋네요,0
6049,2022-08-04 23:22:12,1,22년4월에 9월날짜로예약했는데 8월에 메시지로 자기네 본인 가족이 사용해야한다며 일방적 취소한달 남겨놓고 취소제가 할 수 있는건 암것도 없네요호스트를 위한 앱쓰레기다신 안 쓴다퉤퉤,9
6050,2022-08-04 23:26:11,1,5개월전에 예약했는데 한달 남겨놓고 일방적 호스트의 취소 이유는 지들이 쓴다는 거근데 더 어이없는건 내가 할 수 있는것은 화 삭히고 다른곳을 찾는거쓰레기 호스트만을 위한 쓰레기 앱다신 안 쓴다,9
6051,2022-08-05 08:51:35,5,이걸 왜 이제 알았지,7
6052,2022-08-05 19:14:35,1,게스트를 뜨내기 취급하는 업제뉴스로 접하는 것을 실제경험하니 황당하기도 하고 정말 열받더라호스트가 일방적으로 예약 취소해도 게스트따위는 찍소리 못하고 손해 감수해야함다신 안 쓴다,9
6053,2022-08-08 19:16:39,5,구,7
6054,2022-08-08 22:01:56,5,저렴하게 숙소 예약해서 매우 만족,0
6055,2022-08-09 17:01:50,5,좋은 곳 많이 공유,1
6056,2022-08-10 16:26:16,1,로그인이 안 돼요,9
6057,2022-08-11 00:15:51,5,아들때문에 알게됐는데좋은숙소에 가격까지 좋아요,1
6058,2022-08-12 22:02:48,5,사용이 무지 편리하고 정보가 많은 것 같습니다,6
6059,2022-08-12 22:21:02,5,편리합니다 꼭 설치하세요,1
6060,2022-08-13 11:46:58,1,계속 오류나서 로그인도 예약도 안되고 다시 깔아도 똑같은데 문제있는거 아나모르나 오류420코드 뜬다고요답답,9
6061,2022-08-14 18:21:56,5,이용하기 편하고 좋아요,1
6062,2022-08-15 02:00:59,5,좋아요 단지 어플이 너무 직관정지 않아요,7
6063,2022-08-15 12:24:36,5,빠르고 좋음,0
6064,2022-08-15 14:27:19,2,신분증을 앞뒤로 찍어내라는 건 너무 과한것 아닌가요 요즘 어떤 앱에서 그렇게 하나요,9
6065,2022-08-15 17:07:51,1,사용하기 어렵고 예약변경도 어렵고 예약자 변경도 안됨,9
6066,2022-08-15 23:05:18,5,좋네요 어플덕에 가성비좋은 숙소도 찾고,1
6067,2022-08-16 23:21:44,1,스크롤 넘기면 초기 화면으로 올라감,5
6068,2022-08-17 15:10:09,5,사용하기 편리하고 좋은숙소 정보들이 많아요,5
6069,2022-08-17 17:59:02,1,환불시스템 진짜 진짜 진짜 별로에요 24시간도 안 돼서 환불했는데 7만원이나 안 돌려줬어요 별 하나도 아깝네요 고객지원팀에 얘기했더니 호스트가 연락을 안 받아서 어쩔 수 없다고 막 그러더라구요 정말정말 별로입니다 그냥 돈 더 주고 좋은 데서 사용하세요 환불시스템을 비롯한 기반이 되게 부실하고 최악 그 자체네요,9
6070,2022-08-18 00:37:19,4,셀프 사진을 찍을려고 하는데 엄청 버벅거려 포기합니다 그 이외에는 나쁘지 않았습니다,7
6071,2022-08-18 16:39:30,5,편의성에 만족합니다,1
6072,2022-08-19 11:42:16,5,일단 예약이 엄청 편하네요,0
6073,2022-08-20 21:03:48,5,어마어마햐,0
6074,2022-08-20 22:25:24,5,편리하고 유용합니다,1
6075,2022-08-21 15:53:08,3,가는 곳마다 게스트한테 청소를 시키는 게 블편,9
6076,2022-08-22 16:29:03,5,잘 애용하고있음,1
6077,2022-08-22 18:20:55,3,어려웠어요,9
6078,2022-08-23 11:11:37,5,매우유용하고 해외 개인 휴가시 잘사용하고있습니다,1
6079,2022-08-23 15:51:17,1,호스트 관리도 엉망 대응도 엉망임 방바닥에는 얼룩이 덕지덕지 수건에도 음식물이 묻어있고 욕실에는 곰팡이가 피어있는 숙소를 제공받았는데 연락하니까 사소한 문제에 대해서는 최대 1박의 10만 환불이 된다고 함 폐가나 다름없는 곳을 등록하는 호스트나 사소한 문제니까 넘어가라는 업체나 할 수 없이 청소비만이라도 환불 받고 직접 청소한 뒤 사용함 다른 사람들 안 당하게 리뷰라도 열심히 써서 올렸는데 며칠째 내가 쓴 리뷰는 등록 안됨 다시는 이용안할 예정,9
6080,2022-08-23 23:43:00,4,숙소비 외에 청소비 수수료에 관한 부분이 부가적으로 청구되는지 몰랐다 미리 공지되었으면 하는 아쉬움 그것 하나 뿐입니다,7
6081,2022-08-24 11:19:30,4,가성비 좋은 숙소가 많아요,5
6082,2022-08-24 17:56:15,5,매우 유용함,0
6083,2022-08-24 18:04:30,5,빠른예약 저렴한 숙박시설 검색,5
6084,2022-08-25 12:15:36,2,주말에 써서 예약내역 보려는데 왜 로그아웃되고 다시 로그인 시도하는데 예약요청에 실패했다는 알림만 뜨나요,9
6085,2022-08-25 13:14:01,2,핸드폰 에어비앤비 앱 로그아웃되고 로그인 시도시 예약문제라고하면서 로그인이 안됩니다 계속,9
6086,2022-08-25 15:55:21,1,계속로그인안되고 휴대번호로 번호인증하는것도계속안돼서답답해요,9
6087,2022-08-26 00:01:32,1,저도 오늘 갑자기 로그인 안되네요 내일 당장 여행일인데 무슨일이죠,7
6088,2022-08-26 09:50:00,1,로그인도 안되고 예약요청에 문제 발생했습니다 만 띄우고 있습니다 노트북으로 하니 잘만 됩니다 어플리케이션 문제인 것 같은데 해결 부탁합니다,9
6089,2022-08-26 23:34:43,1,결제등록 이 자꾸 불가능하다는데 왜그런가여,9
6090,2022-08-27 00:56:46,1,뭐가 하나도 안되네요 검색도 안되고 최신 리뷰에 댓글 달린것처럼 도움말에서 피드백 남기려고 해도 안들어가지고 개인정보도 입력하는데 저장안되고 그 무엇도 오류라고만 나옵니다,9
6091,2022-08-27 20:36:27,1,숙박업소 예약하는데 프사가 왜피료함,9
6092,2022-08-27 22:44:28,1,그냥 한마디로 bubble 무능,9
6093,2022-08-28 15:20:18,5,굿 좋은 숙소를 저렴하게 예약하고 편하게 이용할 수 있는 좋은 어플인정,0
6094,2022-08-28 15:46:10,5,필터설정하여 원하는 숙소를 편리하게 찾을 수 있음,5
6095,2022-08-30 10:17:03,1,리뷰 안남기는 사람임 하도 빡쳐서 첨 씀 글자제약 있어 말 짧음 해외에서 비앤비에 결제됨 88에 360달러 40달러 두건임 당근 내가한거 아님 비앤비에 취소요청함 이틀후 40달러짜리 한건은 취소됨 360달러짜리 취소가 되지 않아 비앤비에 문의함 이때부터 대환장 파티의 시작 고객센터에 전화해서 문의함 상담원은 같은 말만 반복함 결제취소는 다른부서의 업무라 잘 전달하겠습니다 이 말을 각기다른 상담사에게 7번쯤 들었음 소용이 없다는 말임 메일로 담당부서에 직접문의함 너가 은행에 취소요청을 했던데 우린 환불 못해줌이라고 답장옴 당근 난 취소요청 한적이 없음 다시 문의함 내가 어디에 뭘 요청했는지 알려달라 두건의 결제중 한건만 취소된 이유를 알려달라등등수차례 문의함 답 없음 도대체 언제까지 기다려야하는지도 알수 없음 당근 카드회사 확인함 내가 취소요청한것 없으며 비앤비에서 결제취소를 해줘야 한다는 답변 받음 리뷰 답변보고 또씀 상담원 무한루프 이거 뭐하잖거지,9
6096,2022-08-31 00:28:11,1,예약하려니 http 420 만 뜨고 지웠다 다시 깔아도 똑같아요 예약 아예 안되는데 어떻게해야하죠,9
6097,2022-09-01 19:01:34,5,편하고좋음,0
6098,2022-09-01 21:43:05,1,안좋음,9
6099,2022-09-01 21:58:39,1,이런 개같은 경우가 있나 폐업한 숙소를 처리도 안하고 걍 결제되게하네요 호스트는 연락도 안되고 멀리 여행했는데 장장 4시간동안 처리도 안해주고 정처없이 기다리다가 결국은 이도저도 안됬네요 뭐죠이건 교육이고 나발이고 일처리가 아무것도 안되는데 왜 자꾸 녹음한다 어멋지다 했던 말이나 또하고 물어보는건가요 참 관리 더럽게 안되네요 앞으로 이용할생각 없습니다,9
6100,2022-09-02 13:58:08,4,금액 필터링 거는거에 오류가 계속 생겨서 필터링이 안되네요,9
6101,2022-09-02 22:04:26,1,이거 왜 가격 조정 선이 자꾸 안되나요,9
6102,2022-09-02 23:21:00,2,결제가 너무 불편해요,9
6103,2022-09-02 23:21:20,5,빠르고 친절하고 좋습니다,1
6104,2022-09-03 15:55:42,2,가격대 설정하는게 안돼요 최대금액을 줄이려고 했는데 최소금액 높이는것만 되고 최대금액 줄여지는건 안되네요,9
6105,2022-09-03 22:40:25,1,주차 여부 제대로 안써놔서 당연히 주차되는지 알고 예약함 결제하고 주차는 되는거 맞냐고 호스트한테 물어보니 안된다해서 바로 환불요청하니 수수료 50프로뗌 숙소정보에 당연히 주차여부는 표시해야되는게 의무아닌가요 에어비앤비 측에서는 주차에 대한 내용을 기재하는게 필수가 아니라는데 무슨 말도 안되는 소릴하는건지 당연히 주차여부는 숙소에 대한 정보이기 때문에 페이지에 기재해야 하고요 인터넷으로 물건을 살때도 물건에 대한 상세정보를 기재해야하듯이 주차여부가 당연이 숙소에 머무는데 필수적인 정보라고요 결제한지 30분도 안되서 취소요청하니 호스트가 시간을 질질 끌더니 대체예약에 대한 부담으로 전액환불은 안된다고 하네요 담주 예약 텅텅 비어있는 아무도 예약안하는 숙소를 제가 예약한건데 대체예약에 대한 부담이 단 30분안에 생기는건가요 저런 미흡한부분이 있으면 개선할 생각을 해야지 계속 주차여부 표시는 의무가 아니라는둥 소비자를 위해 제대로된 정보를 제공하실 생각은 없나봐요,9
6106,2022-09-04 02:33:58,5,덕분에 여행 즐겁게 하는 중입니다 감사합니다,1
6107,2022-09-04 21:52:26,1,불편,9
6108,2022-09-05 13:08:05,5,어디를 가서 잘 곳을 찾을때는 언제나 어디서나 특별한 에어비앤비에서 찾아봅니다,4
6109,2022-09-05 20:29:50,4,방 많음,5
6110,2022-09-05 21:18:33,5,예약하기 편해요 대답도 확실해요,1
6111,2022-09-07 05:40:35,5,다들 좋다고하니 해외여행에 꼭 사용해볼겁니다,4
6112,2022-09-07 10:31:38,4,나름 좋은듯,0
